{
  "artifacts": {
    "output_tree": {
      "bytes": 3,
      "path": "samples/startup-lcov-version-warmup-000/output-tree.json",
      "sha256": "sha256:37517e5f3dc66819f61f5a7bb8ace1921282415f10551d2defa5c3eb0985b570"
    },
    "stderr": {
      "bytes": 0,
      "path": "samples/startup-lcov-version-warmup-000/stderr.bin",
      "sha256": "sha256:e3b0c44298fc1c149afbf4c8996fb92427ae41e4649b934ca495991b7852b855"
    },
    "stdout": {
      "bytes": 28,
      "path": "samples/startup-lcov-version-warmup-000/stdout.bin",
      "sha256": "sha256:553f99eb62b6dac64b08057e128411879b9f10b294517d82b8ef42c8796310c9"
    }
  },
  "case_id": "startup-lcov-version",
  "clock": "monotonic",
  "execution_manifest_sha256": "sha256:a15e953f5dfa176ac0d2f2b0c8668f190951f64e58a69bd9e63365e8eb3ea981",
  "family": "startup",
  "fixture_tree_sha256": null,
  "measurement_backend": "linux-rusage-children-v1",
  "measurement_tool_sha256": "sha256:0d19be022b27b886862290148770dea10d2c7ac9b62dbd75a1cc1e4b230a4687",
  "metrics": {
    "output_bytes": 0,
    "output_files": 0,
    "peak_rss_bytes": 34734080,
    "system_cpu_time_ns": 11869000,
    "user_cpu_time_ns": 98916000,
    "wall_time_ns": 111225374
  },
  "observed_executable_sha256": "sha256:d99e675e9a076eea47b7861ccb6fa148aba08da8ed1718c002c40ec554c07252",
  "observed_image_sha256": "sha256:b02cc645313ff5b0a09adc6d6ddeb5e670e48d64ac376b6b29b34b9d56eb80b7",
  "outcome": {
    "exit_code": 0,
    "signal": null
  },
  "outcome_matches_expected": true,
  "phase": "warmup",
  "sample_id": "startup-lcov-version-warmup-000",
  "schema_version": 1,
  "sequence": 0,
  "suite_id": "m0-oracle-baseline",
  "suite_sha256": "sha256:2dc1a3ad5028a22e0ab6b1c6315bcf7f9d0d02212cff5fadbf29cca5cf298e48"
}
