{
  "artifacts": {
    "output_tree": {
      "bytes": 190,
      "path": "samples/operation-lcov-merge-warmup-000/output-tree.json",
      "sha256": "sha256:efde8b33d03752e4154c9aa32762f438242d4e485950489b85f4d1b7a4480fcf"
    },
    "stderr": {
      "bytes": 0,
      "path": "samples/operation-lcov-merge-warmup-000/stderr.bin",
      "sha256": "sha256:e3b0c44298fc1c149afbf4c8996fb92427ae41e4649b934ca495991b7852b855"
    },
    "stdout": {
      "bytes": 336,
      "path": "samples/operation-lcov-merge-warmup-000/stdout.bin",
      "sha256": "sha256:0b2b884b8f5f9a27db31d816170230739dfbe5ac50093b22189f47cbe1fb4ce2"
    }
  },
  "case_id": "operation-lcov-merge",
  "clock": "monotonic",
  "execution_manifest_sha256": "sha256:a15e953f5dfa176ac0d2f2b0c8668f190951f64e58a69bd9e63365e8eb3ea981",
  "family": "operation",
  "fixture_tree_sha256": "sha256:175ef5d6a5fcc9533519137128394af9b347bcbc1d0198609d037b43d1bb6fde",
  "measurement_backend": "linux-rusage-children-v1",
  "measurement_tool_sha256": "sha256:0d19be022b27b886862290148770dea10d2c7ac9b62dbd75a1cc1e4b230a4687",
  "metrics": {
    "output_bytes": 225,
    "output_files": 1,
    "peak_rss_bytes": 34570240,
    "system_cpu_time_ns": 24052000,
    "user_cpu_time_ns": 96210000,
    "wall_time_ns": 120601041
  },
  "observed_executable_sha256": "sha256:d99e675e9a076eea47b7861ccb6fa148aba08da8ed1718c002c40ec554c07252",
  "observed_image_sha256": "sha256:b02cc645313ff5b0a09adc6d6ddeb5e670e48d64ac376b6b29b34b9d56eb80b7",
  "outcome": {
    "exit_code": 0,
    "signal": null
  },
  "outcome_matches_expected": true,
  "phase": "warmup",
  "sample_id": "operation-lcov-merge-warmup-000",
  "schema_version": 1,
  "sequence": 8,
  "suite_id": "m0-oracle-baseline",
  "suite_sha256": "sha256:2dc1a3ad5028a22e0ab6b1c6315bcf7f9d0d02212cff5fadbf29cca5cf298e48"
}
