{
  "artifacts": {
    "output_tree": {
      "bytes": 2760,
      "path": "samples/report-genhtml-default-measured-002/output-tree.json",
      "sha256": "sha256:f8e42c0433d562edc74210e69d64e959348851627b038f954ac78bb741a4c368"
    },
    "stderr": {
      "bytes": 0,
      "path": "samples/report-genhtml-default-measured-002/stderr.bin",
      "sha256": "sha256:e3b0c44298fc1c149afbf4c8996fb92427ae41e4649b934ca495991b7852b855"
    },
    "stdout": {
      "bytes": 340,
      "path": "samples/report-genhtml-default-measured-002/stdout.bin",
      "sha256": "sha256:4d67c2f1f794915860b1a03107c5d7ccef83aa92fbe3b573129d73278f0fe4e3"
    }
  },
  "case_id": "report-genhtml-default",
  "clock": "monotonic",
  "execution_manifest_sha256": "sha256:a15e953f5dfa176ac0d2f2b0c8668f190951f64e58a69bd9e63365e8eb3ea981",
  "family": "report",
  "fixture_tree_sha256": "sha256:13885aec01ea29c3a11cc7ffa257c74f67abe31b3f405b02c3780008944be879",
  "measurement_backend": "linux-rusage-children-v1",
  "measurement_tool_sha256": "sha256:0d19be022b27b886862290148770dea10d2c7ac9b62dbd75a1cc1e4b230a4687",
  "metrics": {
    "output_bytes": 46057,
    "output_files": 13,
    "peak_rss_bytes": 41779200,
    "system_cpu_time_ns": 31564000,
    "user_cpu_time_ns": 110474000,
    "wall_time_ns": 143148760
  },
  "observed_executable_sha256": "sha256:8ef84c95ce3970f6ba4743e81dd91e4dacca71266478801982179362204b2b6a",
  "observed_image_sha256": "sha256:b02cc645313ff5b0a09adc6d6ddeb5e670e48d64ac376b6b29b34b9d56eb80b7",
  "outcome": {
    "exit_code": 0,
    "signal": null
  },
  "outcome_matches_expected": true,
  "phase": "measured",
  "sample_id": "report-genhtml-default-measured-002",
  "schema_version": 1,
  "sequence": 15,
  "suite_id": "m0-oracle-baseline",
  "suite_sha256": "sha256:2dc1a3ad5028a22e0ab6b1c6315bcf7f9d0d02212cff5fadbf29cca5cf298e48"
}
